{
  "artifact_records": [
    {
      "digest": "73e9dc5c0f2b03e009474079155790fd841abfaaf22c714bf9112e83c2e3aba9",
      "path_or_uri": "evidence/environment/qual-20260910T012822/manifest.json",
      "verification_method": "LOCAL_HASH",
      "verification_receipt_ref": null
    },
    {
      "digest": "61af155ff04becddc7665d245783ea32b45378df4f38c21635c74ee5a056d01c",
      "path_or_uri": "evidence/environment/qual-20260910T012822/health-transcript.json",
      "verification_method": "LOCAL_HASH",
      "verification_receipt_ref": null
    },
    {
      "digest": "59eb760f9c6a88580eb9c7d84d7df6ac9a0e373ce39a403b277d0012bc478335",
      "path_or_uri": "quansio/platform/cache.py",
      "verification_method": "LOCAL_HASH",
      "verification_receipt_ref": null
    },
    {
      "digest": "3c796add73123c3a23b93b6462dc9e2aa141e3cb7a7c08ebaeacc6d7bf8d39b0",
      "path_or_uri": "tests/runtime/test_foundation.py",
      "verification_method": "LOCAL_HASH",
      "verification_receipt_ref": null
    }
  ],
  "assertion_results": [
    {
      "assertion_id": "DAT-002-A01",
      "blocking": true,
      "details": "executed: tests/runtime/test_foundation.py::test_dat007_r01_leases_reacquire_from_authoritative_state_after_restart; environment: {\"machine\": \"arm64\", \"os\": \"macOS-26.5.1-arm64-arm-64bit\", \"pytest\": \"pytest 9.1.1\", \"python\": \"3.12.13\"}",
      "status": "PASS"
    },
    {
      "assertion_id": "DAT-007-N01",
      "blocking": true,
      "details": "executed: tests/runtime/test_foundation.py::test_dat007_p01_and_n01_cache_flush_loses_no_canonical_truth; environment: {\"machine\": \"arm64\", \"os\": \"macOS-26.5.1-arm64-arm-64bit\", \"pytest\": \"pytest 9.1.1\", \"python\": \"3.12.13\"}",
      "status": "PASS"
    },
    {
      "assertion_id": "DAT-007-P01",
      "blocking": true,
      "details": "executed: tests/runtime/test_foundation.py::test_dat007_p01_and_n01_cache_flush_loses_no_canonical_truth; environment: {\"machine\": \"arm64\", \"os\": \"macOS-26.5.1-arm64-arm-64bit\", \"pytest\": \"pytest 9.1.1\", \"python\": \"3.12.13\"}",
      "status": "PASS"
    },
    {
      "assertion_id": "DAT-007-R01",
      "blocking": true,
      "details": "executed: tests/runtime/test_foundation.py::test_dat007_r01_leases_reacquire_from_authoritative_state_after_restart; environment: {\"machine\": \"arm64\", \"os\": \"macOS-26.5.1-arm64-arm-64bit\", \"pytest\": \"pytest 9.1.1\", \"python\": \"3.12.13\"}",
      "status": "PASS"
    },
    {
      "assertion_id": "INV-007-A01",
      "blocking": true,
      "details": "executed: tests/runtime/test_foundation.py::test_dat007_p01_and_n01_cache_flush_loses_no_canonical_truth; tests/runtime/test_foundation.py::test_dat007_r01_leases_reacquire_from_authoritative_state_after_restart; environment: {\"machine\": \"arm64\", \"os\": \"macOS-26.5.1-arm64-arm-64bit\", \"pytest\": \"pytest 9.1.1\", \"python\": \"3.12.13\"}",
      "status": "PASS"
    }
  ],
  "configuration_digest": "6d55e4d9fbe5a768497b9ad411bd41dbf33c24b9ceeea05625f9e6728b61a35a",
  "environment_id": "local-darwin-arm64-py312",
  "executed_at": "2026-09-10T01:28:48Z",
  "git_commit": "361ba54dd45a0216e4e65c9332e8a8c1355f1ac0",
  "protected_ref": "HEAD",
  "real_boundary": true,
  "report_id": "report-dat-007-361ba54dd45a",
  "repository_id": "https://github.com/moss101/quansiov2",
  "schema_revision": "9.0.0",
  "status": "PASS",
  "task_id": "DAT-007"
}
