{
  "artifact_records": [
    {
      "digest": "23523af07fa7b15a33951e5f4372a3bc6a526a64490896e3da88310556b7d567",
      "path_or_uri": "evidence/boundary/RUN-003/manifest.json",
      "verification_method": "LOCAL_HASH",
      "verification_receipt_ref": null
    },
    {
      "digest": "4d756fa81bb35ca539c4bff5b6cd0b58f812ccf1a8fe692939957c7d7ad12b57",
      "path_or_uri": "evidence/boundary/RUN-003/health-transcript.json",
      "verification_method": "LOCAL_HASH",
      "verification_receipt_ref": null
    },
    {
      "digest": "3556ca6ecf5c2eba6aa32ca0fafba038a85029aaa8328021d5779a90b04b0e55",
      "path_or_uri": "quansio/runtime/graphs.py",
      "verification_method": "LOCAL_HASH",
      "verification_receipt_ref": null
    },
    {
      "digest": "d6070231f0d7bc2438ac8eb6883364633c9f0f1bcbeb060391bbfdbc18f21d35",
      "path_or_uri": "tests/runtime/test_graphs_agents.py",
      "verification_method": "LOCAL_HASH",
      "verification_receipt_ref": null
    }
  ],
  "assertion_results": [
    {
      "assertion_id": "RUN-001-A01",
      "blocking": true,
      "details": "executed: tests/runtime/test_graphs_agents.py::test_run003_p01_multi_object_transition_is_atomic_and_emits_one_event; tests/runtime/test_graphs_agents.py::test_run003_r01_transaction_identity_prevents_second_mutation; environment: {\"machine\": \"arm64\", \"os\": \"macOS-26.5.1-arm64-arm-64bit\", \"pytest\": \"pytest 9.1.1\", \"python\": \"3.12.13\"}",
      "status": "PASS"
    },
    {
      "assertion_id": "RUN-003-N01",
      "blocking": true,
      "details": "executed: tests/runtime/test_graphs_agents.py::test_run003_n01_precondition_failure_commits_nothing; environment: {\"machine\": \"arm64\", \"os\": \"macOS-26.5.1-arm64-arm-64bit\", \"pytest\": \"pytest 9.1.1\", \"python\": \"3.12.13\"}",
      "status": "PASS"
    },
    {
      "assertion_id": "RUN-003-P01",
      "blocking": true,
      "details": "executed: tests/runtime/test_graphs_agents.py::test_run003_p01_multi_object_transition_is_atomic_and_emits_one_event; environment: {\"machine\": \"arm64\", \"os\": \"macOS-26.5.1-arm64-arm-64bit\", \"pytest\": \"pytest 9.1.1\", \"python\": \"3.12.13\"}",
      "status": "PASS"
    },
    {
      "assertion_id": "RUN-003-R01",
      "blocking": true,
      "details": "executed: tests/runtime/test_graphs_agents.py::test_run003_r01_transaction_identity_prevents_second_mutation; environment: {\"machine\": \"arm64\", \"os\": \"macOS-26.5.1-arm64-arm-64bit\", \"pytest\": \"pytest 9.1.1\", \"python\": \"3.12.13\"}",
      "status": "PASS"
    }
  ],
  "configuration_digest": "6d55e4d9fbe5a768497b9ad411bd41dbf33c24b9ceeea05625f9e6728b61a35a",
  "environment_id": "local-darwin-arm64-py312",
  "executed_at": "2026-09-10T02:40:05Z",
  "git_commit": "a0117584050d084889eed8bfa22dd1331fc9ab5f",
  "protected_ref": "HEAD",
  "real_boundary": true,
  "report_id": "report-run-003-a0117584050d",
  "repository_id": "https://github.com/moss101/quansiov2",
  "schema_revision": "9.0.0",
  "status": "PASS",
  "task_id": "RUN-003"
}
