{
  "artifact_records": [
    {
      "digest": "aed5f8d1bfb833b63613ef375a2e3b6c96f55b2ce316dde91f2ef207f6cb7632",
      "path_or_uri": "evidence/boundary/MAC-006/manifest.json",
      "verification_method": "LOCAL_HASH",
      "verification_receipt_ref": null
    },
    {
      "digest": "4918257bbf15d719355e68314c8909127b067840fdeec8bf402f06b6d413eca6",
      "path_or_uri": "evidence/boundary/MAC-006/health-transcript.json",
      "verification_method": "LOCAL_HASH",
      "verification_receipt_ref": null
    },
    {
      "digest": "804919a0467ce905634efc1e29c7e8110f80d97b1ad707817ffffde1e57a38d3",
      "path_or_uri": "quansio/machine_control/services.py",
      "verification_method": "LOCAL_HASH",
      "verification_receipt_ref": null
    },
    {
      "digest": "5a4b43e7ed9afde818916a4eb816c1d406f5719c09029a4002fd699aebb5049f",
      "path_or_uri": "tests/machines/test_machine_fabric.py",
      "verification_method": "LOCAL_HASH",
      "verification_receipt_ref": null
    }
  ],
  "assertion_results": [
    {
      "assertion_id": "MAC-004-A01",
      "blocking": true,
      "details": "executed: tests/machines/test_machine_fabric.py::test_mac004_p01_deliver_ack_only_after_durable_result; environment: {\"machine\": \"arm64\", \"os\": \"macOS-26.5.1-arm64-arm-64bit\", \"pytest\": \"pytest 9.1.1\", \"python\": \"3.12.13\"}",
      "status": "PASS"
    },
    {
      "assertion_id": "MAC-006-N01",
      "blocking": true,
      "details": "executed: tests/machines/test_machine_fabric.py::test_mac006_n01_cross_tenant_attachment_refused; environment: {\"machine\": \"arm64\", \"os\": \"macOS-26.5.1-arm64-arm-64bit\", \"pytest\": \"pytest 9.1.1\", \"python\": \"3.12.13\"}",
      "status": "PASS"
    },
    {
      "assertion_id": "MAC-006-P01",
      "blocking": true,
      "details": "executed: tests/machines/test_machine_fabric.py::test_mac006_p01_workspace_binding_and_state_survive_hibernation; environment: {\"machine\": \"arm64\", \"os\": \"macOS-26.5.1-arm64-arm-64bit\", \"pytest\": \"pytest 9.1.1\", \"python\": \"3.12.13\"}",
      "status": "PASS"
    },
    {
      "assertion_id": "MAC-006-R01",
      "blocking": true,
      "details": "executed: tests/machines/test_machine_fabric.py::test_mac006_p01_workspace_binding_and_state_survive_hibernation; environment: {\"machine\": \"arm64\", \"os\": \"macOS-26.5.1-arm64-arm-64bit\", \"pytest\": \"pytest 9.1.1\", \"python\": \"3.12.13\"}",
      "status": "PASS"
    },
    {
      "assertion_id": "RUN-008-A01",
      "blocking": true,
      "details": "executed: tests/machines/test_machine_fabric.py::test_mac006_p01_workspace_binding_and_state_survive_hibernation; environment: {\"machine\": \"arm64\", \"os\": \"macOS-26.5.1-arm64-arm-64bit\", \"pytest\": \"pytest 9.1.1\", \"python\": \"3.12.13\"}",
      "status": "PASS"
    }
  ],
  "configuration_digest": "6d55e4d9fbe5a768497b9ad411bd41dbf33c24b9ceeea05625f9e6728b61a35a",
  "environment_id": "local-darwin-arm64-py312",
  "executed_at": "2026-09-10T08:42:47Z",
  "git_commit": "ed05c22cd50ba7bad5dde988bd0060c2de02a8bd",
  "protected_ref": "HEAD",
  "real_boundary": true,
  "report_id": "report-mac-006-ed05c22cd50b",
  "repository_id": "https://github.com/moss101/quansiov2",
  "schema_revision": "9.0.0",
  "status": "PASS",
  "task_id": "MAC-006"
}
