{
  "artifact_records": [
    {
      "digest": "dba08190ab3f3a18f51f3d649d63f5fbe2677175e7821dd5de3f076a58182332",
      "path_or_uri": "evidence/boundary/EXT-003/manifest.json",
      "verification_method": "LOCAL_HASH",
      "verification_receipt_ref": null
    },
    {
      "digest": "88e93d99428c75d8b39402bafea3ba962f8477477ac983edc6ed436cabb70ec0",
      "path_or_uri": "evidence/boundary/EXT-003/health-transcript.json",
      "verification_method": "LOCAL_HASH",
      "verification_receipt_ref": null
    },
    {
      "digest": "5f61032bda7e88aba9823289b929a26f51456f586dbaead62fe4f700c5ffbb54",
      "path_or_uri": "quansio/control/connectors.py",
      "verification_method": "LOCAL_HASH",
      "verification_receipt_ref": null
    },
    {
      "digest": "5c22455602893691e21263e07e63d196bd8d5b38b9138454ab338ebbe35051fb",
      "path_or_uri": "tests/business/test_business_connectors.py",
      "verification_method": "LOCAL_HASH",
      "verification_receipt_ref": null
    }
  ],
  "assertion_results": [
    {
      "assertion_id": "EXT-003-A01",
      "blocking": true,
      "details": "executed: tests/business/test_business_connectors.py::test_ext003_p01_authenticated_ingress_creates_work_once; tests/business/test_business_connectors.py::test_ext003_n01_replay_and_invalid_signature_rejected; tests/business/test_business_connectors.py::test_ext003_r01_crash_between_ingress_and_work_resumes_once; environment: {\"machine\": \"arm64\", \"os\": \"macOS-26.5.1-arm64-arm-64bit\", \"pytest\": \"pytest 9.1.1\", \"python\": \"3.12.13\"}",
      "status": "PASS"
    },
    {
      "assertion_id": "EXT-003-N01",
      "blocking": true,
      "details": "executed: tests/business/test_business_connectors.py::test_ext003_n01_replay_and_invalid_signature_rejected; environment: {\"machine\": \"arm64\", \"os\": \"macOS-26.5.1-arm64-arm-64bit\", \"pytest\": \"pytest 9.1.1\", \"python\": \"3.12.13\"}",
      "status": "PASS"
    },
    {
      "assertion_id": "EXT-003-P01",
      "blocking": true,
      "details": "executed: tests/business/test_business_connectors.py::test_ext003_p01_authenticated_ingress_creates_work_once; environment: {\"machine\": \"arm64\", \"os\": \"macOS-26.5.1-arm64-arm-64bit\", \"pytest\": \"pytest 9.1.1\", \"python\": \"3.12.13\"}",
      "status": "PASS"
    },
    {
      "assertion_id": "EXT-003-R01",
      "blocking": true,
      "details": "executed: tests/business/test_business_connectors.py::test_ext003_r01_crash_between_ingress_and_work_resumes_once; environment: {\"machine\": \"arm64\", \"os\": \"macOS-26.5.1-arm64-arm-64bit\", \"pytest\": \"pytest 9.1.1\", \"python\": \"3.12.13\"}",
      "status": "PASS"
    }
  ],
  "configuration_digest": "6d55e4d9fbe5a768497b9ad411bd41dbf33c24b9ceeea05625f9e6728b61a35a",
  "environment_id": "local-darwin-arm64-py312",
  "executed_at": "2026-09-10T10:49:59Z",
  "git_commit": "af9afb92cb5145ee6a909c8296f5a32b138f53f1",
  "protected_ref": "HEAD",
  "real_boundary": true,
  "report_id": "report-ext-003-af9afb92cb51",
  "repository_id": "https://github.com/moss101/quansiov2",
  "schema_revision": "9.0.0",
  "status": "PASS",
  "task_id": "EXT-003"
}
