{
  "artifact_records": [
    {
      "digest": "79ca9f6a61071971d5a498b1b7be39be9dd5886c20198b1ddbf34bbcc627aafa",
      "path_or_uri": "evidence/boundary/CTX-005/manifest.json",
      "verification_method": "LOCAL_HASH",
      "verification_receipt_ref": null
    },
    {
      "digest": "7672de6d3fe8dfa5d671807ba18545eaa7d56398dc6d6da2c39881250a585311",
      "path_or_uri": "evidence/boundary/CTX-005/health-transcript.json",
      "verification_method": "LOCAL_HASH",
      "verification_receipt_ref": null
    },
    {
      "digest": "315b4c895c48a35f6ec1e137afa76c0c6009a796d519644d300f3026e2f64f6a",
      "path_or_uri": "quansio/context/verification.py",
      "verification_method": "LOCAL_HASH",
      "verification_receipt_ref": null
    },
    {
      "digest": "bf843afc6deb91cedc427c1801bf7f93a902f3dcb366d185e3aead41c565400d",
      "path_or_uri": "tests/context/test_context_stack.py",
      "verification_method": "LOCAL_HASH",
      "verification_receipt_ref": null
    }
  ],
  "assertion_results": [
    {
      "assertion_id": "CTX-005-A01",
      "blocking": true,
      "details": "executed: tests/context/test_context_stack.py::test_ctx005_p01_refetch_classifies_claim_states; tests/context/test_context_stack.py::test_ctx005_n01_altered_claim_fails_despite_citation; tests/context/test_context_stack.py::test_ctx005_r01_accessible_to_inaccessible_keeps_last_digest; environment: {\"machine\": \"arm64\", \"os\": \"macOS-26.5.1-arm64-arm-64bit\", \"pytest\": \"pytest 9.1.1\", \"python\": \"3.12.13\"}",
      "status": "PASS"
    },
    {
      "assertion_id": "CTX-005-N01",
      "blocking": true,
      "details": "executed: tests/context/test_context_stack.py::test_ctx005_n01_altered_claim_fails_despite_citation; environment: {\"machine\": \"arm64\", \"os\": \"macOS-26.5.1-arm64-arm-64bit\", \"pytest\": \"pytest 9.1.1\", \"python\": \"3.12.13\"}",
      "status": "PASS"
    },
    {
      "assertion_id": "CTX-005-P01",
      "blocking": true,
      "details": "executed: tests/context/test_context_stack.py::test_ctx005_p01_refetch_classifies_claim_states; environment: {\"machine\": \"arm64\", \"os\": \"macOS-26.5.1-arm64-arm-64bit\", \"pytest\": \"pytest 9.1.1\", \"python\": \"3.12.13\"}",
      "status": "PASS"
    },
    {
      "assertion_id": "CTX-005-R01",
      "blocking": true,
      "details": "executed: tests/context/test_context_stack.py::test_ctx005_r01_accessible_to_inaccessible_keeps_last_digest; environment: {\"machine\": \"arm64\", \"os\": \"macOS-26.5.1-arm64-arm-64bit\", \"pytest\": \"pytest 9.1.1\", \"python\": \"3.12.13\"}",
      "status": "PASS"
    }
  ],
  "configuration_digest": "6d55e4d9fbe5a768497b9ad411bd41dbf33c24b9ceeea05625f9e6728b61a35a",
  "environment_id": "local-darwin-arm64-py312",
  "executed_at": "2026-09-10T05:14:57Z",
  "git_commit": "3a62b141e6409c05b8c6f7e581c5ce21e9a0ce1c",
  "protected_ref": "HEAD",
  "real_boundary": true,
  "report_id": "report-ctx-005-3a62b141e640",
  "repository_id": "https://github.com/moss101/quansiov2",
  "schema_revision": "9.0.0",
  "status": "PASS",
  "task_id": "CTX-005"
}
