{
  "artifact_records": [
    {
      "digest": "b8f3fe172f61ae06f5ee2c18eb38cae1d9b52b6fd5ec91b5afc5e3b275525dad",
      "path_or_uri": "evidence/boundary/SKL-003/manifest.json",
      "verification_method": "LOCAL_HASH",
      "verification_receipt_ref": null
    },
    {
      "digest": "b2db59a4fd8800aba06fa2d041567afcdbf3916b383626bc7abe89b3aef70502",
      "path_or_uri": "evidence/boundary/SKL-003/health-transcript.json",
      "verification_method": "LOCAL_HASH",
      "verification_receipt_ref": null
    },
    {
      "digest": "33b0abaa7f631f002a33a8c89ca50523119747e0e0abdb0d6a27f4111eb8b532",
      "path_or_uri": "quansio/control/skills.py",
      "verification_method": "LOCAL_HASH",
      "verification_receipt_ref": null
    },
    {
      "digest": "e1687d51b0dfdfd83e9222666aef266aeeb1f535a37f701d09a68dc69035330c",
      "path_or_uri": "quansio/qworkerd/protocol.py",
      "verification_method": "LOCAL_HASH",
      "verification_receipt_ref": null
    },
    {
      "digest": "a5990e834dc3ae7022a0f3cb2c163926b83d50bd60da0698cf9dc41326452102",
      "path_or_uri": "tests/knowledge/test_knowledge_skills.py",
      "verification_method": "LOCAL_HASH",
      "verification_receipt_ref": null
    }
  ],
  "assertion_results": [
    {
      "assertion_id": "SKL-002-A01",
      "blocking": true,
      "details": "executed: tests/knowledge/test_knowledge_skills.py::test_skl002_p01_clean_package_passes_evaluation; environment: {\"machine\": \"arm64\", \"os\": \"macOS-26.5.1-arm64-arm-64bit\", \"pytest\": \"pytest 9.1.1\", \"python\": \"3.12.13\"}",
      "status": "PASS"
    },
    {
      "assertion_id": "SKL-003-N01",
      "blocking": true,
      "details": "executed: tests/knowledge/test_knowledge_skills.py::test_skl003_n01_mock_substitution_blocks_qualification; environment: {\"machine\": \"arm64\", \"os\": \"macOS-26.5.1-arm64-arm-64bit\", \"pytest\": \"pytest 9.1.1\", \"python\": \"3.12.13\"}",
      "status": "PASS"
    },
    {
      "assertion_id": "SKL-003-P01",
      "blocking": true,
      "details": "executed: tests/knowledge/test_knowledge_skills.py::test_skl003_p01_isolated_cases_with_real_boundary; environment: {\"machine\": \"arm64\", \"os\": \"macOS-26.5.1-arm64-arm-64bit\", \"pytest\": \"pytest 9.1.1\", \"python\": \"3.12.13\"}",
      "status": "PASS"
    },
    {
      "assertion_id": "SKL-003-R01",
      "blocking": true,
      "details": "executed: tests/knowledge/test_knowledge_skills.py::test_skl003_r01_crashed_case_restarts_with_clean_isolation; environment: {\"machine\": \"arm64\", \"os\": \"macOS-26.5.1-arm64-arm-64bit\", \"pytest\": \"pytest 9.1.1\", \"python\": \"3.12.13\"}",
      "status": "PASS"
    }
  ],
  "configuration_digest": "6d55e4d9fbe5a768497b9ad411bd41dbf33c24b9ceeea05625f9e6728b61a35a",
  "environment_id": "local-darwin-arm64-py312",
  "executed_at": "2026-09-10T08:51:46Z",
  "git_commit": "aedd1b92fb5af071d5b32c958d78fa5c9097692a",
  "protected_ref": "HEAD",
  "real_boundary": true,
  "report_id": "report-skl-003-aedd1b92fb5a",
  "repository_id": "https://github.com/moss101/quansiov2",
  "schema_revision": "9.0.0",
  "status": "PASS",
  "task_id": "SKL-003"
}
