{
  "artifact_records": [
    {
      "digest": "c834a40092404d1fa15fb26dd78242ae531f22752014894f9ee05faa26e0723a",
      "path_or_uri": "evidence/boundary/SRE-001/manifest.json",
      "verification_method": "LOCAL_HASH",
      "verification_receipt_ref": null
    },
    {
      "digest": "d62d136eabc51b5ce24144803c0f11120c61225c409120cd12a6594c2d5b95e4",
      "path_or_uri": "evidence/boundary/SRE-001/health-transcript.json",
      "verification_method": "LOCAL_HASH",
      "verification_receipt_ref": null
    },
    {
      "digest": "bf20b3c8b950a5a1868716210b3873c2ee56c59b1e38f9b7d0b8ffb1ed409dcc",
      "path_or_uri": "quansio/observability/telemetry.py",
      "verification_method": "LOCAL_HASH",
      "verification_receipt_ref": null
    },
    {
      "digest": "3c9e8697006473fe8fd20fdf4afd560b44df79e96ff66750a824749716258119",
      "path_or_uri": "migrations/up/0019_sre_security.sql",
      "verification_method": "LOCAL_HASH",
      "verification_receipt_ref": null
    },
    {
      "digest": "f400cc49af444bcb996c24b73062f2c66433f224bfb87dfb180fe9c5fa8b17af",
      "path_or_uri": "tests/sre/test_sre_security.py",
      "verification_method": "LOCAL_HASH",
      "verification_receipt_ref": null
    }
  ],
  "assertion_results": [
    {
      "assertion_id": "SRE-001-A01",
      "blocking": true,
      "details": "executed: tests/sre/test_sre_security.py::test_sre001_p01_full_trace_correlation_without_leakage; tests/sre/test_sre_security.py::test_sre001_n01_missing_boundary_fails_completeness; tests/sre/test_sre_security.py::test_sre001_r01_bounded_buffer_during_backend_outage; environment: {\"machine\": \"arm64\", \"os\": \"macOS-26.5.1-arm64-arm-64bit\", \"pytest\": \"pytest 9.1.1\", \"python\": \"3.12.13\"}",
      "status": "PASS"
    },
    {
      "assertion_id": "SRE-001-N01",
      "blocking": true,
      "details": "executed: tests/sre/test_sre_security.py::test_sre001_n01_missing_boundary_fails_completeness; environment: {\"machine\": \"arm64\", \"os\": \"macOS-26.5.1-arm64-arm-64bit\", \"pytest\": \"pytest 9.1.1\", \"python\": \"3.12.13\"}",
      "status": "PASS"
    },
    {
      "assertion_id": "SRE-001-P01",
      "blocking": true,
      "details": "executed: tests/sre/test_sre_security.py::test_sre001_p01_full_trace_correlation_without_leakage; tests/services/test_service_surfaces.py::test_degraded_dependency_returns_readyz_503; environment: {\"machine\": \"arm64\", \"os\": \"macOS-26.5.1-arm64-arm-64bit\", \"pytest\": \"pytest 9.1.1\", \"python\": \"3.12.13\"}",
      "status": "PASS"
    },
    {
      "assertion_id": "SRE-001-R01",
      "blocking": true,
      "details": "executed: tests/sre/test_sre_security.py::test_sre001_r01_bounded_buffer_during_backend_outage; environment: {\"machine\": \"arm64\", \"os\": \"macOS-26.5.1-arm64-arm-64bit\", \"pytest\": \"pytest 9.1.1\", \"python\": \"3.12.13\"}",
      "status": "PASS"
    }
  ],
  "configuration_digest": "6d55e4d9fbe5a768497b9ad411bd41dbf33c24b9ceeea05625f9e6728b61a35a",
  "environment_id": "local-darwin-arm64-py312",
  "executed_at": "2026-09-11T09:12:20Z",
  "git_commit": "f2edeebf7795ee1ab2f0575c87c975b390623edc",
  "protected_ref": "HEAD",
  "real_boundary": true,
  "report_id": "report-sre-001-f2edeebf7795",
  "repository_id": "https://github.com/moss101/quansiov2",
  "schema_revision": "9.0.0",
  "status": "PASS",
  "task_id": "SRE-001"
}
