{
  "artifact_records": [
    {
      "digest": "421c0717f5bc11db05e6ef4fad83ccfdb53bc24f0fcc1659bcafb626f45cdbc7",
      "path_or_uri": "evidence/boundary/SRE-002/manifest.json",
      "verification_method": "LOCAL_HASH",
      "verification_receipt_ref": null
    },
    {
      "digest": "0b358019398b070663ee6300cd2e347de9029468e5d838c8541dd5d57880149a",
      "path_or_uri": "evidence/boundary/SRE-002/health-transcript.json",
      "verification_method": "LOCAL_HASH",
      "verification_receipt_ref": null
    },
    {
      "digest": "bf20b3c8b950a5a1868716210b3873c2ee56c59b1e38f9b7d0b8ffb1ed409dcc",
      "path_or_uri": "quansio/observability/telemetry.py",
      "verification_method": "LOCAL_HASH",
      "verification_receipt_ref": null
    },
    {
      "digest": "f997f4b93499734081cd601af72ce6617906947fbacf9b862341692a548a91a3",
      "path_or_uri": "tests/sre/test_sre_security.py",
      "verification_method": "LOCAL_HASH",
      "verification_receipt_ref": null
    }
  ],
  "assertion_results": [
    {
      "assertion_id": "SRE-001-A01",
      "blocking": true,
      "details": "executed: tests/sre/test_sre_security.py::test_sre002_p01_measurement_with_declared_exclusions; environment: {\"machine\": \"arm64\", \"os\": \"macOS-26.5.1-arm64-arm-64bit\", \"pytest\": \"pytest 9.1.1\", \"python\": \"3.12.13\"}",
      "status": "PASS"
    },
    {
      "assertion_id": "SRE-002-N01",
      "blocking": true,
      "details": "executed: tests/sre/test_sre_security.py::test_sre002_n01_hidden_failure_and_unregistered_exclusion_rejected; environment: {\"machine\": \"arm64\", \"os\": \"macOS-26.5.1-arm64-arm-64bit\", \"pytest\": \"pytest 9.1.1\", \"python\": \"3.12.13\"}",
      "status": "PASS"
    },
    {
      "assertion_id": "SRE-002-P01",
      "blocking": true,
      "details": "executed: tests/sre/test_sre_security.py::test_sre002_p01_measurement_with_declared_exclusions; environment: {\"machine\": \"arm64\", \"os\": \"macOS-26.5.1-arm64-arm-64bit\", \"pytest\": \"pytest 9.1.1\", \"python\": \"3.12.13\"}",
      "status": "PASS"
    },
    {
      "assertion_id": "SRE-002-R01",
      "blocking": true,
      "details": "executed: tests/sre/test_sre_security.py::test_sre002_r01_outage_gap_preserved_as_missing; environment: {\"machine\": \"arm64\", \"os\": \"macOS-26.5.1-arm64-arm-64bit\", \"pytest\": \"pytest 9.1.1\", \"python\": \"3.12.13\"}",
      "status": "PASS"
    },
    {
      "assertion_id": "SRE-004-A01",
      "blocking": true,
      "details": "executed: tests/sre/test_sre_security.py::test_sre004_p01_drills_meet_rpo_rto_objectives; environment: {\"machine\": \"arm64\", \"os\": \"macOS-26.5.1-arm64-arm-64bit\", \"pytest\": \"pytest 9.1.1\", \"python\": \"3.12.13\"}",
      "status": "PASS"
    },
    {
      "assertion_id": "SRE-005-A01",
      "blocking": true,
      "details": "executed: tests/sre/test_sre_security.py::test_sre005_r01_capacity_return_settles_without_storm; environment: {\"machine\": \"arm64\", \"os\": \"macOS-26.5.1-arm64-arm-64bit\", \"pytest\": \"pytest 9.1.1\", \"python\": \"3.12.13\"}",
      "status": "PASS"
    }
  ],
  "configuration_digest": "6d55e4d9fbe5a768497b9ad411bd41dbf33c24b9ceeea05625f9e6728b61a35a",
  "environment_id": "local-darwin-arm64-py312",
  "executed_at": "2026-09-10T15:25:21Z",
  "git_commit": "01dd57eb0d34514f3c23aeb942b8396d08e87c41",
  "protected_ref": "HEAD",
  "real_boundary": true,
  "report_id": "report-sre-002-01dd57eb0d34",
  "repository_id": "https://github.com/moss101/quansiov2",
  "schema_revision": "9.0.0",
  "status": "PASS",
  "task_id": "SRE-002"
}
