{
  "artifact_records": [
    {
      "digest": "6aa7581f82d32d27b7c8ebaa68472e88d18de12840f441834e73721d46a9cc96",
      "path_or_uri": "tools/governance/generate_authority.py",
      "verification_method": "LOCAL_HASH",
      "verification_receipt_ref": null
    },
    {
      "digest": "ecafaee7714fa65613de04ee2c98ad410e24c180fc7355313267d2cebbb33821",
      "path_or_uri": "tests/governance/test_authority_generation.py",
      "verification_method": "LOCAL_HASH",
      "verification_receipt_ref": null
    },
    {
      "digest": "6494bb7d8f4324ef48400ebf5017bfe6dcb97605f28b9b86ceb9b27b314f8f77",
      "path_or_uri": "generated/authority/support-mappings.md",
      "verification_method": "LOCAL_HASH",
      "verification_receipt_ref": null
    }
  ],
  "assertion_results": [
    {
      "assertion_id": "GOV-002-A01",
      "blocking": true,
      "details": "executed: tests/governance/test_authority_generation.py::test_p04_regeneration_twice_is_byte_identical; tests/governance/test_authority_generation.py::test_p04_write_then_check_leaves_clean_tree; tests/governance/test_authority_generation.py::test_n04_hand_edited_task_edge_fails_check; environment: {\"machine\": \"arm64\", \"os\": \"macOS-26.5.1-arm64-arm-64bit\", \"pytest\": \"pytest 9.1.1\", \"python\": \"3.12.13\"}",
      "status": "PASS"
    },
    {
      "assertion_id": "GOV-004-N01",
      "blocking": true,
      "details": "executed: tests/governance/test_authority_generation.py::test_n04_hand_edited_task_edge_fails_check; tests/governance/test_authority_generation.py::test_n04_hand_edited_milestone_count_fails_check; environment: {\"machine\": \"arm64\", \"os\": \"macOS-26.5.1-arm64-arm-64bit\", \"pytest\": \"pytest 9.1.1\", \"python\": \"3.12.13\"}",
      "status": "PASS"
    },
    {
      "assertion_id": "GOV-004-P01",
      "blocking": true,
      "details": "executed: tests/governance/test_authority_generation.py::test_p04_regeneration_twice_is_byte_identical; tests/governance/test_authority_generation.py::test_p04_all_declared_derived_artifacts_are_regenerated; tests/governance/test_authority_generation.py::test_p04_write_then_check_leaves_clean_tree; environment: {\"machine\": \"arm64\", \"os\": \"macOS-26.5.1-arm64-arm-64bit\", \"pytest\": \"pytest 9.1.1\", \"python\": \"3.12.13\"}",
      "status": "PASS"
    },
    {
      "assertion_id": "GOV-004-R01",
      "blocking": true,
      "details": "executed: tests/governance/test_authority_generation.py::test_r04_deleted_generated_view_is_restored_from_registries; environment: {\"machine\": \"arm64\", \"os\": \"macOS-26.5.1-arm64-arm-64bit\", \"pytest\": \"pytest 9.1.1\", \"python\": \"3.12.13\"}",
      "status": "PASS"
    }
  ],
  "configuration_digest": "6d55e4d9fbe5a768497b9ad411bd41dbf33c24b9ceeea05625f9e6728b61a35a",
  "environment_id": "local-darwin-arm64-py312",
  "executed_at": "2026-09-10T00:14:24Z",
  "git_commit": "a5c0eaa977116c8844fc7823c274cae4a46a4ad3",
  "protected_ref": "HEAD",
  "real_boundary": false,
  "report_id": "report-gov-004-a5c0eaa97711",
  "repository_id": "https://github.com/moss101/quansiov2",
  "schema_revision": "9.0.0",
  "status": "PASS",
  "task_id": "GOV-004"
}
