{
  "artifact_records": [
    {
      "digest": "c92a4d86411c55d302fdbe825d8d854edfb57fadcfd15c200c2910e3b758853e",
      "path_or_uri": "evidence/boundary/DAT-008/manifest.json",
      "verification_method": "LOCAL_HASH",
      "verification_receipt_ref": null
    },
    {
      "digest": "5b2b20c7ee51d089cc0a26486842668445a04bb2db26adafd3cf30fc6a132987",
      "path_or_uri": "evidence/boundary/DAT-008/health-transcript.json",
      "verification_method": "LOCAL_HASH",
      "verification_receipt_ref": null
    },
    {
      "digest": "669e10bd6050fc82567a2704610b32a385f768d2fd9d72d36b6f04b3d2345668",
      "path_or_uri": "quansio/platform/repository.py",
      "verification_method": "LOCAL_HASH",
      "verification_receipt_ref": null
    },
    {
      "digest": "99af1c9592d6148f931eb40079e66d04b97ad048c1569ba1d64c21c3e51c0570",
      "path_or_uri": "tests/runtime/test_foundation.py",
      "verification_method": "LOCAL_HASH",
      "verification_receipt_ref": null
    }
  ],
  "assertion_results": [
    {
      "assertion_id": "DAT-002-A01",
      "blocking": true,
      "details": "executed: tests/runtime/test_foundation.py::test_dat008_p01_identical_ids_never_cross_tenant_scope; environment: {\"machine\": \"arm64\", \"os\": \"macOS-26.5.1-arm64-arm-64bit\", \"pytest\": \"pytest 9.1.1\", \"python\": \"3.12.13\"}",
      "status": "PASS"
    },
    {
      "assertion_id": "DAT-008-N01",
      "blocking": true,
      "details": "executed: tests/runtime/test_foundation.py::test_dat008_n01_foreign_tenant_parameter_is_denied_before_materialization; environment: {\"machine\": \"arm64\", \"os\": \"macOS-26.5.1-arm64-arm-64bit\", \"pytest\": \"pytest 9.1.1\", \"python\": \"3.12.13\"}",
      "status": "PASS"
    },
    {
      "assertion_id": "DAT-008-P01",
      "blocking": true,
      "details": "executed: tests/runtime/test_foundation.py::test_dat008_p01_identical_ids_never_cross_tenant_scope; environment: {\"machine\": \"arm64\", \"os\": \"macOS-26.5.1-arm64-arm-64bit\", \"pytest\": \"pytest 9.1.1\", \"python\": \"3.12.13\"}",
      "status": "PASS"
    },
    {
      "assertion_id": "DAT-008-R01",
      "blocking": true,
      "details": "executed: tests/runtime/test_foundation.py::test_dat008_r01_isolation_probes_rerun_after_connection_failover; environment: {\"machine\": \"arm64\", \"os\": \"macOS-26.5.1-arm64-arm-64bit\", \"pytest\": \"pytest 9.1.1\", \"python\": \"3.12.13\"}",
      "status": "PASS"
    },
    {
      "assertion_id": "SEC-006-A01",
      "blocking": true,
      "details": "executed: tests/runtime/test_foundation.py::test_dat008_p01_identical_ids_never_cross_tenant_scope; tests/runtime/test_foundation.py::test_dat008_n01_foreign_tenant_parameter_is_denied_before_materialization; environment: {\"machine\": \"arm64\", \"os\": \"macOS-26.5.1-arm64-arm-64bit\", \"pytest\": \"pytest 9.1.1\", \"python\": \"3.12.13\"}",
      "status": "PASS"
    }
  ],
  "configuration_digest": "6d55e4d9fbe5a768497b9ad411bd41dbf33c24b9ceeea05625f9e6728b61a35a",
  "environment_id": "local-darwin-arm64-py312",
  "executed_at": "2026-09-10T02:43:42Z",
  "git_commit": "8009e8e8848eaf1f166c92cd891d07e19c64a1d7",
  "protected_ref": "HEAD",
  "real_boundary": true,
  "report_id": "report-dat-008-8009e8e8848e",
  "repository_id": "https://github.com/moss101/quansiov2",
  "schema_revision": "9.0.0",
  "status": "PASS",
  "task_id": "DAT-008"
}
