{
  "artifact_records": [
    {
      "digest": "0799f5f49ab000ef1ef2670732e87c25fd8da530bb3cfe8b91ebd233cb2a58e6",
      "path_or_uri": "tools/governance/milestone_gate.py",
      "verification_method": "LOCAL_HASH",
      "verification_receipt_ref": null
    },
    {
      "digest": "40d961004216777b2945a02aaa46763be79a54363f8dd232fcdae06f728c492b",
      "path_or_uri": "tests/governance/test_milestone_gate.py",
      "verification_method": "LOCAL_HASH",
      "verification_receipt_ref": null
    },
    {
      "digest": "66c8d994bcdfb225488fa5358c9d2f0d8bf6b46629033d11ea19b41fbaf1f1a4",
      "path_or_uri": "evidence/gates/GATE-M14.json",
      "verification_method": "LOCAL_HASH",
      "verification_receipt_ref": null
    },
    {
      "digest": "b82b74b468946d993cff8e3b50b326fde35ede986f682e5fc8bc5034ae89ff47",
      "path_or_uri": "registries/release-state-machine.json",
      "verification_method": "LOCAL_HASH",
      "verification_receipt_ref": null
    }
  ],
  "assertion_results": [
    {
      "assertion_id": "GATE-M14-N01",
      "blocking": true,
      "details": "executed: tests/governance/test_milestone_gate.py::test_gate_n01_missing_predecessor_refuses_advancement_with_task_identified[GATE-M14]; environment: {\"machine\": \"arm64\", \"os\": \"macOS-26.5.1-arm64-arm-64bit\", \"pytest\": \"pytest 9.1.1\", \"python\": \"3.12.13\"}",
      "status": "PASS"
    },
    {
      "assertion_id": "GATE-M14-P01",
      "blocking": true,
      "details": "executed: tests/governance/test_milestone_gate.py::test_gate_p01_all_predecessors_have_valid_evidence[GATE-M14]; environment: {\"machine\": \"arm64\", \"os\": \"macOS-26.5.1-arm64-arm-64bit\", \"pytest\": \"pytest 9.1.1\", \"python\": \"3.12.13\"}",
      "status": "PASS"
    },
    {
      "assertion_id": "GATE-M14-R01",
      "blocking": true,
      "details": "executed: tests/governance/test_milestone_gate.py::test_gate_r01_restored_gate_matches_prior_evaluation_without_touching_other_evidence[GATE-M14]; environment: {\"machine\": \"arm64\", \"os\": \"macOS-26.5.1-arm64-arm-64bit\", \"pytest\": \"pytest 9.1.1\", \"python\": \"3.12.13\"}",
      "status": "PASS"
    },
    {
      "assertion_id": "INV-008-A01",
      "blocking": true,
      "details": "executed: tests/governance/test_milestone_gate.py::test_gate_p01_all_predecessors_have_valid_evidence[GATE-M14]; tests/governance/test_milestone_gate.py::test_gate_n01_missing_predecessor_refuses_advancement_with_task_identified[GATE-M14]; environment: {\"machine\": \"arm64\", \"os\": \"macOS-26.5.1-arm64-arm-64bit\", \"pytest\": \"pytest 9.1.1\", \"python\": \"3.12.13\"}",
      "status": "PASS"
    },
    {
      "assertion_id": "REL-005-A01",
      "blocking": true,
      "details": "executed: tests/release/test_release.py::test_rel005_p01_and_n01_go_decision; environment: {\"machine\": \"arm64\", \"os\": \"macOS-26.5.1-arm64-arm-64bit\", \"pytest\": \"pytest 9.1.1\", \"python\": \"3.12.13\"}",
      "status": "PASS"
    }
  ],
  "configuration_digest": "6d55e4d9fbe5a768497b9ad411bd41dbf33c24b9ceeea05625f9e6728b61a35a",
  "environment_id": "local-darwin-arm64-py312",
  "executed_at": "2026-09-10T18:04:29Z",
  "git_commit": "7846fd7003d529b57670964fe4e746b3bdf071c5",
  "protected_ref": "HEAD",
  "real_boundary": false,
  "report_id": "report-gate-m14-7846fd7003d5",
  "repository_id": "https://github.com/moss101/quansiov2",
  "schema_revision": "9.0.0",
  "status": "PASS",
  "task_id": "GATE-M14"
}
