{
  "artifact_records": [
    {
      "digest": "b8f3fe172f61ae06f5ee2c18eb38cae1d9b52b6fd5ec91b5afc5e3b275525dad",
      "path_or_uri": "evidence/boundary/KNW-002/manifest.json",
      "verification_method": "LOCAL_HASH",
      "verification_receipt_ref": null
    },
    {
      "digest": "b2db59a4fd8800aba06fa2d041567afcdbf3916b383626bc7abe89b3aef70502",
      "path_or_uri": "evidence/boundary/KNW-002/health-transcript.json",
      "verification_method": "LOCAL_HASH",
      "verification_receipt_ref": null
    },
    {
      "digest": "82d7d16a1d8a843baf4ee45a5cdb250e95605011127efcf307d2d7f9bf400767",
      "path_or_uri": "quansio/context/knowledge.py",
      "verification_method": "LOCAL_HASH",
      "verification_receipt_ref": null
    },
    {
      "digest": "a5990e834dc3ae7022a0f3cb2c163926b83d50bd60da0698cf9dc41326452102",
      "path_or_uri": "tests/knowledge/test_knowledge_skills.py",
      "verification_method": "LOCAL_HASH",
      "verification_receipt_ref": null
    }
  ],
  "assertion_results": [
    {
      "assertion_id": "KNW-002-A01",
      "blocking": true,
      "details": "executed: tests/knowledge/test_knowledge_skills.py::test_knw002_p01_matching_epochs_commit; tests/knowledge/test_knowledge_skills.py::test_knw002_n01_epoch_change_blocks_stale_result; tests/knowledge/test_knowledge_skills.py::test_knw002_r01_worker_restart_recomputes_from_current_epoch; environment: {\"machine\": \"arm64\", \"os\": \"macOS-26.5.1-arm64-arm-64bit\", \"pytest\": \"pytest 9.1.1\", \"python\": \"3.12.13\"}",
      "status": "PASS"
    },
    {
      "assertion_id": "KNW-002-N01",
      "blocking": true,
      "details": "executed: tests/knowledge/test_knowledge_skills.py::test_knw002_n01_epoch_change_blocks_stale_result; environment: {\"machine\": \"arm64\", \"os\": \"macOS-26.5.1-arm64-arm-64bit\", \"pytest\": \"pytest 9.1.1\", \"python\": \"3.12.13\"}",
      "status": "PASS"
    },
    {
      "assertion_id": "KNW-002-P01",
      "blocking": true,
      "details": "executed: tests/knowledge/test_knowledge_skills.py::test_knw002_p01_matching_epochs_commit; environment: {\"machine\": \"arm64\", \"os\": \"macOS-26.5.1-arm64-arm-64bit\", \"pytest\": \"pytest 9.1.1\", \"python\": \"3.12.13\"}",
      "status": "PASS"
    },
    {
      "assertion_id": "KNW-002-R01",
      "blocking": true,
      "details": "executed: tests/knowledge/test_knowledge_skills.py::test_knw002_r01_worker_restart_recomputes_from_current_epoch; environment: {\"machine\": \"arm64\", \"os\": \"macOS-26.5.1-arm64-arm-64bit\", \"pytest\": \"pytest 9.1.1\", \"python\": \"3.12.13\"}",
      "status": "PASS"
    }
  ],
  "configuration_digest": "6d55e4d9fbe5a768497b9ad411bd41dbf33c24b9ceeea05625f9e6728b61a35a",
  "environment_id": "local-darwin-arm64-py312",
  "executed_at": "2026-09-10T08:51:43Z",
  "git_commit": "aedd1b92fb5af071d5b32c958d78fa5c9097692a",
  "protected_ref": "HEAD",
  "real_boundary": true,
  "report_id": "report-knw-002-aedd1b92fb5a",
  "repository_id": "https://github.com/moss101/quansiov2",
  "schema_revision": "9.0.0",
  "status": "PASS",
  "task_id": "KNW-002"
}
